<?xml version="1.0" encoding="utf-8"?>
<xs:schema xmlns:xs="http://www.w3.org/2001/XMLSchema">
	<xs:element name="concesionario">		
		<xs:complexType>
			<xs:sequence>
				<xs:element name="coche" minOccurs="0" maxOccurs="unbounded">
					<xs:complexType>
						<xs:sequence>
							<xs:element name="marca" type="xs:string"/>
							<xs:element name="modelo" type="xs:string"/>
							<xs:choice>
								<xs:element name="cilindrada" type="xs:decimal"/>
								<xs:element name="caballos" type="xs:string"/>
							</xs:choice>
							<xs:element name="combustible" type="xs:string"/>
							<xs:element name="precio" type="xs:string"/>
							<xs:element name="aÃ±o" type="xs:string" minOccurs="0"/>
							<xs:element name="color" type="xs:string"/>
							<xs:element name="interesado" type="xs:string" minOccurs="0" maxOccurs="unbounded"/>
							<xs:element name="fecha_limite" minOccurs="0">
								<xs:complexType>
									<xs:attribute name="fecha" type="xs:date" use="required"/>
								</xs:complexType>
							</xs:element>						
						</xs:sequence>
						
						<xs:attribute name="matricula" type="xs:string" use="required"/>
					</xs:complexType>
				</xs:element>	
			</xs:sequence>
			<xs:attribute name="provincia" type="xs:string"/>
		</xs:complexType>
	
	</xs:element>
</xs:schema>